{
  "$schema": "./art-page.schema.json",
  "id": "tinker-ghost-rider-bell",
  "slug": "tinker",
  "title": {
    "pt": "Tinker Ghost Rider Bell",
    "en": "Tinker Ghost Rider Bell"
  },
  "subtitle": {
    "pt": "Crossover de universos: a fada que se torna motoqueiro fantasma, transformada na textura.",
    "en": "Universe crossover: the fairy turned ghost rider, transformed through texture."
  },
  "icon": "🎭",
  "accent": "purple",
  "mainCategory": "personagens",
  "tags": [
    "personagem",
    "crossover",
    "concurso",
    "veiculo",
    "transformacao-textura"
  ],
  "technologies": [
    "Modelagem 3D",
    "Texturização"
  ],
  "status": "completed",
  "visibility": "public",
  "featured": true,
  "cover_pic": "assets/art/tinker/tinker-banner.png",
  "banner": {
    "src": "assets/art/tinker/tinker-banner.png",
    "alt": "Tinker Ghost Rider Bell",
    "caption": {
      "pt": "Tinker Ghost Rider Bell — a fada transformada em motoqueiro fantasma.",
      "en": "Tinker Ghost Rider Bell — the fairy transformed into a ghost rider."
    }
  },
  "summary": {
    "pt": "Tinker Ghost Rider Bell é a participação em um concurso de crossover de universos, onde a personagem precisava combinar dois universos em uma só leitura. A base é uma fada: pequena, feita à mão, com o calma e a arte de um ser que trabalha com as próprias mãos. Sobre essa base, o conceito de motoqueiro fantasma foi construído — a moto foi modelada como um segundo elemento da cena, e a transformação da personagem foi feita na textura, que reescreve o material da fada para a leitura do motoqueiro espectral. O sino que dá nome ao conceito fecha a iconografia da personagem.",
    "en": "Tinker Ghost Rider Bell is an entry in a universe crossover contest, where the character had to combine two universes into a single read. The base is a fairy: small, handmade in feel, with the calm and the craft of a being that works with its own hands. Over that base, the ghost rider concept was built — the motorcycle was modelled as a second element of the scene, and the character's transformation was done in texture, rewriting the fairy's material into the read of a spectral rider. The bell that gives the concept its name closes the character's iconography."
  },
  "characteristics": [
    {
      "icon": "🏆",
      "label": { "pt": "Contexto", "en": "Context" },
      "value": { "pt": "Concurso de crossover de universos", "en": "Universe crossover contest" }
    },
    {
      "icon": "🧚",
      "label": { "pt": "Natureza base", "en": "Base nature" },
      "value": { "pt": "Fada — ser pequeno, articulado e de oficina", "en": "Fairy — a small, articulated, workshop being" }
    },
    {
      "icon": "🏍️",
      "label": { "pt": "Conceito", "en": "Concept" },
      "value": { "pt": "Motoqueiro fantasma (ghost rider)", "en": "Ghost rider" }
    },
    {
      "icon": "🔔",
      "label": { "pt": "Motivo", "en": "Motif" },
      "value": { "pt": "O sino que nomeia o conceito", "en": "The bell that names the concept" }
    },
    {
      "icon": "🔁",
      "label": { "pt": "Transformação", "en": "Transformation" },
      "value": { "pt": "Aplicada na textura, não na malha", "en": "Applied in texture, not in the mesh" }
    },
    {
      "icon": "🏍️",
      "label": { "pt": "Elemento modelado", "en": "Modelled element" },
      "value": { "pt": "A moto, como segunda leitura da cena", "en": "The motorcycle, as the scene's second read" }
    }
  ],
  "media": [
    {
      "src": "assets/art/tinker/tinker-carrossel-1-1.png",
      "caption": {
        "pt": "A fada em sua leitura base — silhueta pequena, articulada e de oficina.",
        "en": "The fairy in its base read — small silhouette, articulated, of workshop make."
      },
      "alt": "Tinker na leitura base de fada"
    },
    {
      "src": "assets/art/tinker/tinker-carrossel-1-2.png",
      "caption": {
        "pt": "A transformação em motoqueiro fantasma conduzida pela textura.",
        "en": "The transformation into a ghost rider carried by the texture."
      },
      "alt": "Tinker transformada em motoqueiro fantasma"
    },
    {
      "src": "assets/art/tinker/tinker-carrossel-1-3.png",
      "caption": {
        "pt": "A moto modelada — segundo elemento da composição no conceito de crossover.",
        "en": "The modelled motorcycle — the second element of the crossover composition."
      },
      "alt": "A moto do conceito Tinker Ghost Rider"
    },
    {
      "src": "assets/art/tinker/tinker-carrossel-1-4.png",
      "caption": {
        "pt": "Detalhe do sino e da iconografia que fecha o conceito.",
        "en": "Detail of the bell and the iconography that closes the concept."
      },
      "alt": "Detalhe do sino em Tinker Ghost Rider Bell"
    }
  ],
  "process": {
    "pt": "O conceito partiu de uma fada já esculpida e precisou absorver um segundo universo sem perder a própria leitura. A escolha de técnica foi modelar a moto — a metade “ghost rider” do crossover — e tratar a transformação da personagem inteiramente na textura: em vez de duplicar a malha em duas versões, o mesmo sculpt recebe um material reescrito, com spectralidade, a paleta do conceito e a iconografia do sino. O resultado é um conceito em que personagem e veículo contam a mesma história, e em que a troca de universo acontece no shader, não na geometria.",
    "en": "The concept started from an already sculpted fairy and had to absorb a second universe without losing its own read. The technical choice was to model the motorcycle — the “ghost rider” half of the crossover — and to treat the character's transformation entirely in texture: instead of duplicating the mesh into two versions, the same sculpt receives a rewritten material, with spectrality, the concept's palette and the bell iconography. The result is a concept in which character and vehicle tell the same story, and in which the universe swap happens in the shader, not in the geometry."
  },
  "integration": {
    "pt": "A definir",
    "en": "TBD"
  },
  "limitations": [
    {
      "pt": "A transformação depende inteiramente da textura: sem o material reescrito, a personagem lê apenas como fada.",
      "en": "The transformation depends entirely on the texture: without the rewritten material, the character reads only as a fairy."
    }
  ],
  "links": {
    "repositoryUrl": null,
    "buildUrl": null,
    "documentationUrl": null,
    "demoUrl": null
  }
}
