{
  "$schema": "./art-page.schema.json",
  "id": "lily-the-ebony-tusk-chiefleader",
  "slug": "lily",
  "title": {
    "pt": "Lily, the Ebony Tusk Chiefleader",
    "en": "Lily, the Ebony Tusk Chiefleader"
  },
  "subtitle": {
    "pt": "A guerreira nata que lidera o clã Ebony Tusk, esculpida em mesa digital.",
    "en": "The born warrior leading the Ebony Tusk clan, sculpted on a digital tablet."
  },
  "icon": "🎭",
  "accent": "purple",
  "mainCategory": "personagens",
  "tags": [
    "personagem",
    "escultura",
    "mesa-digital",
    "desafio-14-dias",
    "low-poly-estilizado"
  ],
  "technologies": [
    "Escultura com Mesa Digital"
  ],
  "status": "completed",
  "visibility": "public",
  "featured": true,
  "cover_pic": "assets/art/lily/lily-banner.png",
  "banner": {
    "src": "assets/art/lily/lily-banner.png",
    "alt": "Lily, the Ebony Tusk Chiefleader",
    "caption": {
      "pt": "Retrato de Lily, líder do clã Ebony Tusk (Presas de Ébano).",
      "en": "Portrait of Lily, leader of the Ebony Tusk clan."
    }
  },
  "summary": {
    "pt": "Lily é uma personagem feminina, guerreira nata do clã Ebony Tusk (Presas de Ébano). O clã se caracteriza por caçar criaturas de grande porte, usando seus esqueletos como refino nas construções e seus corpos como acessórios de forma geral. Lily herdou a chefia pelo seu espírito de guerra e pela proteção do povo, e decide sempre de maneira justa e correta. A construção da personagem veio do estudo “Desafio de 14 dias”, um trabalho de aprendizado de escultura com mesa digital que validou a prática de detalhamento e refinos complexos.",
    "en": "Lily is a female character, a born warrior of the Ebony Tusk clan. The clan is characterized by hunting large creatures, using their skeletons as refinement in their constructions and their bodies as accessories in general. Lily inherited the chieftaincy through her spirit of war and her protection of the people, and she always decides in a just and correct manner. The character was built from the “14-day Challenge” study, a piece of work for learning digital tablet sculpting that validated the practice of detailed refinement and complex detail."
  },
  "characteristics": [
    {
      "icon": "⚔️",
      "label": { "pt": "Papel", "en": "Role" },
      "value": { "pt": "Guerreira nata — Chiefleader do clã", "en": "Born warrior — clan Chiefleader" }
    },
    {
      "icon": "🛡️",
      "label": { "pt": "Legitimidade", "en": "Legitimacy" },
      "value": { "pt": "Espírito de guerra e proteção do povo", "en": "Spirit of war and protection of the people" }
    },
    {
      "icon": "🦴",
      "label": { "pt": "Tradição do clã", "en": "Clan tradition" },
      "value": { "pt": "Caça de criaturas de grande porte", "en": "Hunting large creatures" }
    },
    {
      "icon": "🏛️",
      "label": { "pt": "Assinatura visual", "en": "Visual signature" },
      "value": { "pt": "Esqueletos nas construções e corpos como acessórios", "en": "Skeletons in constructions, bodies as accessories" }
    },
    {
      "icon": "📅",
      "label": { "pt": "Projeto", "en": "Project" },
      "value": { "pt": "Estudo “Desafio de 14 dias”", "en": "“14-day Challenge” study" }
    },
    {
      "icon": "🖌️",
      "label": { "pt": "Técnica", "en": "Technique" },
      "value": { "pt": "Escultura com mesa digital", "en": "Digital tablet sculpting" }
    },
    {
      "icon": "💎",
      "label": { "pt": "Foco do estudo", "en": "Study focus" },
      "value": { "pt": "Detalhamento e refinos complexos", "en": "Detailed refinement and complex detail" }
    }
  ],
  "media": [
    {
      "src": "assets/art/lily/lily-carrossel-1-1.png",
      "caption": {
        "pt": "Vista geral da personagem — leitura da silhueta e da hierarquia de volumes.",
        "en": "Full view of the character — reading the silhouette and volume hierarchy."
      },
      "alt": "Vista geral de Lily, the Ebony Tusk Chiefleader"
    },
    {
      "src": "assets/art/lily/lily-carrossel-1-2.png",
      "caption": {
        "pt": "Detalhamento do rosto e dos acessórios, onde o refino complexo aparece.",
        "en": "Face and accessory detailing, where the complex refinement shows."
      },
      "alt": "Detalhamento do rosto de Lily"
    },
    {
      "src": "assets/art/lily/lily-carrossel-1-3.png",
      "caption": {
        "pt": "Assinatura do clã: os ossos das presas de Ébano integrados ao visual da personagem.",
        "en": "Clan signature: the Ebony Tusk bones woven into the character's design."
      },
      "alt": "Integração dos elementos do clã Ebony Tusk"
    },
    {
      "src": "assets/art/lily/lily-carrossel-2-1.png",
      "caption": {
        "pt": "Estudo de material e textura da personagem.",
        "en": "Material and texture study of the character."
      },
      "alt": "Estudo de material de Lily"
    },
    {
      "src": "assets/art/lily/lily-carrossel-2-2.png",
      "caption": {
        "pt": "Turnaround e variações de leitura da forma.",
        "en": "Turnaround and shape-reading variations."
      },
      "alt": "Turnaround de Lily"
    }
  ],
  "process": {
    "pt": "A personagem foi construída no contexto do “Desafio de 14 dias”, um estudo pessoal de duração fixa criado para aprender escultura com mesa digital. O objetivo do desafio era forçar a produção de forma detalhada dentro de um prazo curto, e a Lily serviu como o projeto que validou a prática de detalhamento e refinos complexos — a ponto de a construção exigir itens de osso e de criatura de grande porte herdados da cultura do clã.",
    "en": "The character was built within the “14-day Challenge”, a personal fixed-length study created to learn digital tablet sculpting. The challenge's goal was to force detailed output within a short deadline, and Lily served as the project that validated the practice of detailed refinement and complex detail — to the point where the design required bone and large-creature elements inherited from the clan culture."
  },
  "integration": {
    "pt": "A definir",
    "en": "TBD"
  },
  "limitations": [
    {
      "pt": "O material não foi otimizado para engine: as escolhas priorizam leitura de forma e detalhe sobre contagem de polígonos.",
      "en": "The material was not optimised for engine use: the choices prioritise shape reading and detail over triangle count."
    }
  ],
  "links": {
    "repositoryUrl": null,
    "buildUrl": null,
    "documentationUrl": null,
    "demoUrl": null
  }
}
